<?xml version="1.0"?>
<!DOCTYPE Report
[
<!ELEMENT Report (General ,(Doc|BPT)) >
<!ATTLIST Report ver CDATA #REQUIRED tmZone CDATA #REQUIRED>

<!ELEMENT General ( DocLocation ) >
<!ATTLIST General productName CDATA #REQUIRED productVer CDATA #REQUIRED os CDATA #REQUIRED host CDATA #REQUIRED qcserver CDATA #IMPLIED qcproject CDATA #IMPLIED SolManSolutionId CDATA #IMPLIED SolManProjectId CDATA #IMPLIED SolManTestPlanId CDATA #IMPLIED SolManTestPackageId CDATA #IMPLIED SolManUserInfoData CDATA #IMPLIED  >

<!ELEMENT BPT (DName,Res,DVer?,TSet?,TInst?,NodeArgs,AdditionalInfo*,Doc*) >
<!ATTLIST BPT rID ID #REQUIRED >

<!ELEMENT Doc (DName,ConfName?,Res,DVer?,TSet?,TInst?,RunType?,DT?,AdditionalInfo*,Step*,DIter*,Step*,Action*,Doc*,Summary?,TestMaintenanceSummary*,NodeArgs?) >
<!ATTLIST Doc rID ID #REQUIRED type (Test|BC|BPTWrapperTest|Flow|Group|Action) "Test" productName CDATA #REQUIRED BCIter CDATA #IMPLIED >

<!ELEMENT RunType ( #PCDATA )>
<!ATTLIST RunType fmStep (False|True) "False" batch (False|True) "False" upDesc (False|True) "False" upChk (False|True) "False" upAS (False|True) "False">

<!ELEMENT DName ( #PCDATA ) >

<!ELEMENT ConfName ( #PCDATA ) >

<!ELEMENT Res ( #PCDATA ) >

<!ELEMENT AdditionalInfo (AdditionalDataName,AdditionalDataValue ) >

<!ELEMENT AdditionalDataName ( #PCDATA ) >

<!ELEMENT AdditionalDataValue ( #PCDATA ) >

<!ELEMENT DVer ( #PCDATA ) >

<!ELEMENT TSet ( #PCDATA ) >

<!ELEMENT TInst ( #PCDATA ) >

<!ELEMENT DIter (Step*,Action+,Summary?,NodeArgs)>
<!ATTLIST DIter rID ID #REQUIRED iterID CDATA #REQUIRED>

<!ELEMENT DocLocation ( #PCDATA )>

<!ELEMENT Action (AName,AIter*,(Step|HtmlStep|Action)*, Summary,ActionMaintenanceSummary*, NodeArgs ) >
<!ATTLIST Action rID ID #REQUIRED>

<!ELEMENT AIter ((Step|HtmlStep|Action)*,DataMapping?, Summary?,NodeArgs) >
<!ATTLIST AIter rID ID #REQUIRED iterID CDATA #REQUIRED isCountable (False|True) "False" >

<!ELEMENT AName ( #PCDATA ) >

<!ELEMENT TestMaintenanceSummary (ActionMaintenanceSummary*) >
<!ATTLIST TestMaintenanceSummary ObjectsAdded CDATA #REQUIRED ObjectsUpdated CDATA #REQUIRED StepsUpdated CDATA #REQUIRED StepsComments CDATA #REQUIRED><!ELEMENT ActionMaintenanceSummary (ObjectChange* ) >
<!ATTLIST ActionMaintenanceSummary Action CDATA #REQUIRED Objects CDATA #REQUIRED Updated CDATA #REQUIRED LinesTotal CDATA #REQUIRED Added CDATA #REQUIRED LinesUpdated CDATA #REQUIRED>

<!ELEMENT ObjectChange  (Hierarchy, PropertyChangeList* ) >
<!ATTLIST ObjectChange Operation CDATA #IMPLIED OriginalRepository CDATA #IMPLIED>

<!ELEMENT PropertyChangeList (PropertyDef*) >

<!ELEMENT PropertyDef (OriginalValue, NewValue) >
<!ATTLIST PropertyDef PropName CDATA #REQUIRED OriginRegularExpression (True|False) "False" NewRegularExpression (True|False) "False" AddedProperty (True|False) "False" >

<!ELEMENT OriginalValue ( #PCDATA )>

<!ELEMENT NewValue ( #PCDATA )>

<!ELEMENT Hierarchy  (ObjectName, Hierarchy*) >
<!ATTLIST Hierarchy MicClass CDATA #REQUIRED>

<!ELEMENT ObjectName  ( #PCDATA ) >

<!ELEMENT Step (Obj,Details,Time,TimeTick* ,(Step|HtmlStep|Doc)*, DataMapping?, NodeArgs) >
<!ATTLIST Step rID ID #REQUIRED retval CDATA #IMPLIED>

<!ELEMENT HtmlStep (HTML,TimeTick*,(Step|HtmlStep|Doc)*,NodeArgs) >
<!ATTLIST HtmlStep rID ID #REQUIRED >

<!ELEMENT Obj ( #PCDATA ) >
<!ATTLIST Obj plainTxt (False|True) "True">

<!ELEMENT Details ( #PCDATA ) >
<!ATTLIST Details plainTxt (False|True) "True">

<!ELEMENT Time ( #PCDATA ) >

<!ELEMENT HTML ( #PCDATA ) >

<!ELEMENT Disp ( #PCDATA ) >

<!ELEMENT TimeTick ( #PCDATA ) >

<!ELEMENT DataMapping ( DataMappedItem* )>
<!ELEMENT DataMappedItem EMPTY >
<!ATTLIST DataMappedItem dsName CDATA #REQUIRED >
<!ATTLIST DataMappedItem rowId CDATA #REQUIRED >

<!ELEMENT NodeArgs (Disp,TopPane?,BtmPane?,ExtendedInfo? )>
<!ATTLIST NodeArgs eType CDATA #REQUIRED icon CDATA #REQUIRED nRep CDATA #REQUIRED UserNote CDATA #IMPLIED filter (False|True) "True">
<!ATTLIST NodeArgs status (Passed|Failed|Done|Warning|Information) "Done">
<!ATTLIST NodeArgs iconSel CDATA #IMPLIED nType CDATA #IMPLIED MovieMarker CDATA "">
<!ATTLIST NodeArgs Source CDATA #IMPLIED SourceLine CDATA #IMPLIED StepFlowItemKey CDATA #IMPLIED >

<!ELEMENT TopPane (Path)>

<!ELEMENT BtmPane ( (Path|WR)?,ASHilite?)>
<!ATTLIST BtmPane vType CDATA "HTML">

<!ELEMENT Path ( #PCDATA ) >

<!ELEMENT ASHilite ( #PCDATA ) >

<!ELEMENT WR ( #PCDATA ) >

<!ELEMENT ExtendedInfo ( StepData ) >

<!ATTLIST ExtendedInfo StepType CDATA #REQUIRED>
<!ELEMENT DT (NodeArgs) >
<!ATTLIST DT rID ID #REQUIRED>

<!ELEMENT Summary (Param*)>
<!ATTLIST Summary sTime CDATA #IMPLIED eTime CDATA #IMPLIED passed CDATA #IMPLIED failed CDATA #IMPLIED warnings CDATA #IMPLIED retval CDATA #IMPLIED stopped (False|True) "False" >

<!ELEMENT Param (ParamName,ParamVal)+ >
<!ATTLIST Param paramInOut (In|Out) "In">

<!ELEMENT ParamName ( #PCDATA ) >

<!ELEMENT ParamVal ( #PCDATA ) >

]
>
<Report ver="2.0" tmZone="Eastern Standard Time">
<General productName="HP Unified Functional Testing" productVer="12.02" os="Windows 7" host="IFSUFT-PC"><DocLocation><![CDATA[C:\Impact\Trunk_IFS_QuestionTypes\Drivers\SuiteDriver]]></DocLocation></General>
<Doc rID="T1"   productName= "HP Unified Functional Testing"  >
<DName><![CDATA[SuiteDriver]]></DName>
<Res><![CDATA[Res271]]></Res>
<DT rID="T2">
<NodeArgs eType="Table" icon="2" nRep="4" filter="False" >
<Disp><![CDATA[Run-Time Data Table]]></Disp>
<BtmPane vType="Table" >
<Path><![CDATA[Default.xls]]></Path>
</BtmPane>
</NodeArgs>
</DT>
<Action rID="T3">
<AName><![CDATA[Action1]]></AName>
<Step rID="T4">
<Obj plainTxt="False" ><![CDATA[SystemUtil]]></Obj>
<Details plainTxt="False" ><![CDATA[SystemUtil]]></Details>
<Time><![CDATA[2/4/2016 - 15:43:54]]></Time>
<TimeTick>1454618634</TimeTick>
<Step rID="T5">
<Obj plainTxt="False" ><![CDATA[Run "iexplore.exe",3]]></Obj>
<Details plainTxt="False" ><![CDATA[Run "iexplore.exe",3]]></Details>
<Time><![CDATA[2/4/2016 - 15:43:54]]></Time>
<TimeTick>1454618634</TimeTick>
<NodeArgs eType="Replay" icon="4" nRep="10" status="Passed" >
<Disp><![CDATA[Run "iexplore.exe",3]]></Disp>
</NodeArgs>
</Step>
<NodeArgs eType="Replay" icon="4" nRep="9" status="Passed" >
<Disp><![CDATA[SystemUtil]]></Disp>
</NodeArgs>
</Step>
<Step rID="T6">
<Obj plainTxt="False" ><![CDATA[Login]]></Obj>
<Details plainTxt="False" ><![CDATA[Browser]]></Details>
<Time><![CDATA[2/4/2016 - 15:44:04]]></Time>
<TimeTick>1454618644</TimeTick>
<Step rID="T7">
<Obj plainTxt="False" ><![CDATA[Login]]></Obj>
<Details plainTxt="False" ><![CDATA[Page]]></Details>
<Time><![CDATA[2/4/2016 - 15:44:04]]></Time>
<TimeTick>1454618644</TimeTick>
<Step rID="T8">
<Obj plainTxt="False" ><![CDATA[Login.Sync]]></Obj>
<Details plainTxt="False" ><![CDATA[]]></Details>
<Time><![CDATA[2/4/2016 - 15:44:04]]></Time>
<TimeTick>1454618644</TimeTick>
<NodeArgs eType="Replay" icon="6" nRep="15" >
<Disp><![CDATA[Login.Sync]]></Disp>
</NodeArgs>
</Step>
<NodeArgs eType="Context" icon="6" nRep="14" >
<Disp><![CDATA[Login]]></Disp>
</NodeArgs>
</Step>
<NodeArgs eType="Context" icon="5" nRep="13" >
<Disp><![CDATA[Login]]></Disp>
</NodeArgs>
</Step>
<Step rID="T9">
<Obj ><![CDATA[Login]]></Obj>
<Details ><![CDATA[]]></Details>
<Time><![CDATA[2/4/2016 - 15:44:04]]></Time>
<TimeTick>1454618644</TimeTick>
<NodeArgs eType="User" icon="7" nRep="16" status="Passed" >
<Disp><![CDATA[Login]]></Disp>
</NodeArgs>
</Step>
<Step rID="T10">
<Obj plainTxt="False" ><![CDATA[Login]]></Obj>
<Details plainTxt="False" ><![CDATA[Browser]]></Details>
<Time><![CDATA[2/4/2016 - 15:44:04]]></Time>
<TimeTick>1454618644</TimeTick>
<Step rID="T11">
<Obj plainTxt="False" ><![CDATA[Login]]></Obj>
<Details plainTxt="False" ><![CDATA[Page]]></Details>
<Time><![CDATA[2/4/2016 - 15:44:04]]></Time>
<TimeTick>1454618644</TimeTick>
<Step rID="T12">
<Obj plainTxt="False" ><![CDATA[TXT_user_name.Exist]]></Obj>
<Details plainTxt="False" ><![CDATA["Object exists"]]></Details>
<Time><![CDATA[2/4/2016 - 15:44:04]]></Time>
<TimeTick>1454618644</TimeTick>
<NodeArgs eType="Replay" icon="8" nRep="20" >
<Disp><![CDATA[TXT_user_name.Exist]]></Disp>
</NodeArgs>
</Step>
<Step rID="T13">
<Obj plainTxt="False" ><![CDATA[TXT_user_name.Set]]></Obj>
<Details plainTxt="False" ><![CDATA["chrisj"]]></Details>
<Time><![CDATA[2/4/2016 - 15:44:04]]></Time>
<TimeTick>1454618644</TimeTick>
<NodeArgs eType="Replay" icon="8" nRep="22" >
<Disp><![CDATA[TXT_user_name.Set]]></Disp>
</NodeArgs>
</Step>
<NodeArgs eType="Context" icon="6" nRep="19" >
<Disp><![CDATA[Login]]></Disp>
</NodeArgs>
</Step>
<NodeArgs eType="Context" icon="5" nRep="18" >
<Disp><![CDATA[Login]]></Disp>
</NodeArgs>
</Step>
<Step rID="T14">
<Obj ><![CDATA[Login]]></Obj>
<Details ><![CDATA[]]></Details>
<Time><![CDATA[2/4/2016 - 15:44:04]]></Time>
<TimeTick>1454618644</TimeTick>
<NodeArgs eType="User" icon="7" nRep="23" status="Passed" >
<Disp><![CDATA[Login]]></Disp>
</NodeArgs>
</Step>
<Step rID="T15">
<Obj plainTxt="False" ><![CDATA[Login]]></Obj>
<Details plainTxt="False" ><![CDATA[Browser]]></Details>
<Time><![CDATA[2/4/2016 - 15:44:04]]></Time>
<TimeTick>1454618644</TimeTick>
<Step rID="T16">
<Obj plainTxt="False" ><![CDATA[Login]]></Obj>
<Details plainTxt="False" ><![CDATA[Page]]></Details>
<Time><![CDATA[2/4/2016 - 15:44:04]]></Time>
<TimeTick>1454618644</TimeTick>
<Step rID="T17">
<Obj plainTxt="False" ><![CDATA[TXT_user_password.Exist]]></Obj>
<Details plainTxt="False" ><![CDATA["Object exists"]]></Details>
<Time><![CDATA[2/4/2016 - 15:44:04]]></Time>
<TimeTick>1454618644</TimeTick>
<NodeArgs eType="Replay" icon="8" nRep="27" >
<Disp><![CDATA[TXT_user_password.Exist]]></Disp>
</NodeArgs>
</Step>
<Step rID="T18">
<Obj plainTxt="False" ><![CDATA[TXT_user_password.Set]]></Obj>
<Details plainTxt="False" ><![CDATA["password"]]></Details>
<Time><![CDATA[2/4/2016 - 15:44:04]]></Time>
<TimeTick>1454618644</TimeTick>
<NodeArgs eType="Replay" icon="8" nRep="29" >
<Disp><![CDATA[TXT_user_password.Set]]></Disp>
</NodeArgs>
</Step>
<NodeArgs eType="Context" icon="6" nRep="26" >
<Disp><![CDATA[Login]]></Disp>
</NodeArgs>
</Step>
<NodeArgs eType="Context" icon="5" nRep="25" >
<Disp><![CDATA[Login]]></Disp>
</NodeArgs>
</Step>
<Step rID="T19">
<Obj ><![CDATA[Login]]></Obj>
<Details ><![CDATA[]]></Details>
<Time><![CDATA[2/4/2016 - 15:44:04]]></Time>
<TimeTick>1454618644</TimeTick>
<NodeArgs eType="User" icon="7" nRep="30" status="Passed" >
<Disp><![CDATA[Login]]></Disp>
</NodeArgs>
</Step>
<Step rID="T20">
<Obj plainTxt="False" ><![CDATA[Login]]></Obj>
<Details plainTxt="False" ><![CDATA[Browser]]></Details>
<Time><![CDATA[2/4/2016 - 15:44:04]]></Time>
<TimeTick>1454618644</TimeTick>
<Step rID="T21">
<Obj plainTxt="False" ><![CDATA[Login]]></Obj>
<Details plainTxt="False" ><![CDATA[Page]]></Details>
<Time><![CDATA[2/4/2016 - 15:44:04]]></Time>
<TimeTick>1454618644</TimeTick>
<Step rID="T22">
<Obj plainTxt="False" ><![CDATA[BTN_Log In.Exist]]></Obj>
<Details plainTxt="False" ><![CDATA["Object exists"]]></Details>
<Time><![CDATA[2/4/2016 - 15:44:04]]></Time>
<TimeTick>1454618644</TimeTick>
<NodeArgs eType="Replay" icon="9" nRep="34" >
<Disp><![CDATA[BTN_Log In.Exist]]></Disp>
</NodeArgs>
</Step>
<Step rID="T23">
<Obj plainTxt="False" ><![CDATA[BTN_Log In.Click]]></Obj>
<Details plainTxt="False" ><![CDATA[]]></Details>
<Time><![CDATA[2/4/2016 - 15:44:04]]></Time>
<TimeTick>1454618644</TimeTick>
<NodeArgs eType="Replay" icon="9" nRep="36" >
<Disp><![CDATA[BTN_Log In.Click]]></Disp>
</NodeArgs>
</Step>
<NodeArgs eType="Context" icon="6" nRep="33" >
<Disp><![CDATA[Login]]></Disp>
</NodeArgs>
</Step>
<NodeArgs eType="Context" icon="5" nRep="32" >
<Disp><![CDATA[Login]]></Disp>
</NodeArgs>
</Step>
<Step rID="T24">
<Obj ><![CDATA[Login]]></Obj>
<Details ><![CDATA[]]></Details>
<Time><![CDATA[2/4/2016 - 15:44:05]]></Time>
<TimeTick>1454618645</TimeTick>
<NodeArgs eType="User" icon="7" nRep="37" status="Passed" >
<Disp><![CDATA[Login]]></Disp>
</NodeArgs>
</Step>
<Step rID="T25">
<Obj plainTxt="False" ><![CDATA[Work Queue]]></Obj>
<Details plainTxt="False" ><![CDATA[Browser]]></Details>
<Time><![CDATA[2/4/2016 - 15:44:06]]></Time>
<TimeTick>1454618646</TimeTick>
<Step rID="T26">
<Obj plainTxt="False" ><![CDATA[Work Queue]]></Obj>
<Details plainTxt="False" ><![CDATA[Page]]></Details>
<Time><![CDATA[2/4/2016 - 15:44:06]]></Time>
<TimeTick>1454618646</TimeTick>
<Step rID="T27">
<Obj plainTxt="False" ><![CDATA[TAB _Home.Exist]]></Obj>
<Details plainTxt="False" ><![CDATA["Object exists"]]></Details>
<Time><![CDATA[2/4/2016 - 15:44:06]]></Time>
<TimeTick>1454618646</TimeTick>
<NodeArgs eType="Replay" icon="10" nRep="41" >
<Disp><![CDATA[TAB _Home.Exist]]></Disp>
</NodeArgs>
</Step>
<Step rID="T28">
<Obj plainTxt="False" ><![CDATA[Work Queue.Sync]]></Obj>
<Details plainTxt="False" ><![CDATA[]]></Details>
<Time><![CDATA[2/4/2016 - 15:44:06]]></Time>
<TimeTick>1454618646</TimeTick>
<NodeArgs eType="Replay" icon="6" nRep="43" >
<Disp><![CDATA[Work Queue.Sync]]></Disp>
</NodeArgs>
</Step>
<Step rID="T29">
<Obj plainTxt="False" ><![CDATA[TAB _Home.Exist]]></Obj>
<Details plainTxt="False" ><![CDATA["Object exists"]]></Details>
<Time><![CDATA[2/4/2016 - 15:44:08]]></Time>
<TimeTick>1454618648</TimeTick>
<NodeArgs eType="Replay" icon="10" nRep="45" >
<Disp><![CDATA[TAB _Home.Exist]]></Disp>
</NodeArgs>
</Step>
<NodeArgs eType="Context" icon="6" nRep="40" >
<Disp><![CDATA[Work Queue]]></Disp>
</NodeArgs>
</Step>
<NodeArgs eType="Context" icon="5" nRep="39" >
<Disp><![CDATA[Work Queue]]></Disp>
</NodeArgs>
</Step>
<Step rID="T30">
<Obj ><![CDATA[Login]]></Obj>
<Details ><![CDATA[]]></Details>
<Time><![CDATA[2/4/2016 - 15:44:11]]></Time>
<TimeTick>1454618651</TimeTick>
<NodeArgs eType="User" icon="7" nRep="46" status="Passed" >
<Disp><![CDATA[Login]]></Disp>
</NodeArgs>
</Step>
<Step rID="T31">
<Obj plainTxt="False" ><![CDATA[Work Queue]]></Obj>
<Details plainTxt="False" ><![CDATA[Browser]]></Details>
<Time><![CDATA[2/4/2016 - 15:44:18]]></Time>
<TimeTick>1454618658</TimeTick>
<Step rID="T32">
<Obj plainTxt="False" ><![CDATA[Work Queue]]></Obj>
<Details plainTxt="False" ><![CDATA[Page]]></Details>
<Time><![CDATA[2/4/2016 - 15:44:18]]></Time>
<TimeTick>1454618658</TimeTick>
<Step rID="T33">
<Obj plainTxt="False" ><![CDATA[TAB _Home.Exist]]></Obj>
<Details plainTxt="False" ><![CDATA["Object exists"]]></Details>
<Time><![CDATA[2/4/2016 - 15:44:18]]></Time>
<TimeTick>1454618658</TimeTick>
<NodeArgs eType="Replay" icon="10" nRep="50" >
<Disp><![CDATA[TAB _Home.Exist]]></Disp>
</NodeArgs>
</Step>
<NodeArgs eType="Context" icon="6" nRep="49" >
<Disp><![CDATA[Work Queue]]></Disp>
</NodeArgs>
</Step>
<NodeArgs eType="Context" icon="5" nRep="48" >
<Disp><![CDATA[Work Queue]]></Disp>
</NodeArgs>
</Step>
<Step rID="T34">
<Obj ><![CDATA[NavigateToStrings]]></Obj>
<Details ><![CDATA[]]></Details>
<Time><![CDATA[2/4/2016 - 15:44:18]]></Time>
<TimeTick>1454618658</TimeTick>
<NodeArgs eType="User" icon="7" nRep="51" status="Passed" >
<Disp><![CDATA[NavigateToStrings]]></Disp>
</NodeArgs>
</Step>
<Step rID="T35">
<Obj plainTxt="False" ><![CDATA[Work Queue]]></Obj>
<Details plainTxt="False" ><![CDATA[Browser]]></Details>
<Time><![CDATA[2/4/2016 - 15:44:22]]></Time>
<TimeTick>1454618662</TimeTick>
<Step rID="T36">
<Obj plainTxt="False" ><![CDATA[Work Queue]]></Obj>
<Details plainTxt="False" ><![CDATA[Page]]></Details>
<Time><![CDATA[2/4/2016 - 15:44:22]]></Time>
<TimeTick>1454618662</TimeTick>
<Step rID="T37">
<Obj plainTxt="False" ><![CDATA[TAB_Tests.Exist]]></Obj>
<Details plainTxt="False" ><![CDATA["Object exists"]]></Details>
<Time><![CDATA[2/4/2016 - 15:44:22]]></Time>
<TimeTick>1454618662</TimeTick>
<NodeArgs eType="Replay" icon="10" nRep="55" >
<Disp><![CDATA[TAB_Tests.Exist]]></Disp>
</NodeArgs>
</Step>
<Step rID="T38">
<Obj plainTxt="False" ><![CDATA[TAB_Tests.Click]]></Obj>
<Details plainTxt="False" ><![CDATA[]]></Details>
<Time><![CDATA[2/4/2016 - 15:44:22]]></Time>
<TimeTick>1454618662</TimeTick>
<NodeArgs eType="Replay" icon="10" nRep="57" >
<Disp><![CDATA[TAB_Tests.Click]]></Disp>
</NodeArgs>
</Step>
<NodeArgs eType="Context" icon="6" nRep="54" >
<Disp><![CDATA[Work Queue]]></Disp>
</NodeArgs>
</Step>
<NodeArgs eType="Context" icon="5" nRep="53" >
<Disp><![CDATA[Work Queue]]></Disp>
</NodeArgs>
</Step>
<Step rID="T39">
<Obj ><![CDATA[NavigateToStrings]]></Obj>
<Details ><![CDATA[]]></Details>
<Time><![CDATA[2/4/2016 - 15:44:22]]></Time>
<TimeTick>1454618662</TimeTick>
<NodeArgs eType="User" icon="7" nRep="58" status="Passed" >
<Disp><![CDATA[NavigateToStrings]]></Disp>
</NodeArgs>
</Step>
<Step rID="T40">
<Obj plainTxt="False" ><![CDATA[Work Queue]]></Obj>
<Details plainTxt="False" ><![CDATA[Browser]]></Details>
<Time><![CDATA[2/4/2016 - 15:44:26]]></Time>
<TimeTick>1454618666</TimeTick>
<Step rID="T41">
<Obj plainTxt="False" ><![CDATA[Work Queue]]></Obj>
<Details plainTxt="False" ><![CDATA[Page]]></Details>
<Time><![CDATA[2/4/2016 - 15:44:26]]></Time>
<TimeTick>1454618666</TimeTick>
<Step rID="T42">
<Obj plainTxt="False" ><![CDATA[LNK_Test Question Types.Exist]]></Obj>
<Details plainTxt="False" ><![CDATA["Object exists"]]></Details>
<Time><![CDATA[2/4/2016 - 15:44:26]]></Time>
<TimeTick>1454618666</TimeTick>
<NodeArgs eType="Replay" icon="10" nRep="62" >
<Disp><![CDATA[LNK_Test Question Types.Exist]]></Disp>
</NodeArgs>
</Step>
<Step rID="T43">
<Obj plainTxt="False" ><![CDATA[LNK_Test Question Types.Click]]></Obj>
<Details plainTxt="False" ><![CDATA[]]></Details>
<Time><![CDATA[2/4/2016 - 15:44:26]]></Time>
<TimeTick>1454618666</TimeTick>
<NodeArgs eType="Replay" icon="10" nRep="64" >
<Disp><![CDATA[LNK_Test Question Types.Click]]></Disp>
</NodeArgs>
</Step>
<NodeArgs eType="Context" icon="6" nRep="61" >
<Disp><![CDATA[Work Queue]]></Disp>
</NodeArgs>
</Step>
<NodeArgs eType="Context" icon="5" nRep="60" >
<Disp><![CDATA[Work Queue]]></Disp>
</NodeArgs>
</Step>
<Step rID="T44">
<Obj ><![CDATA[NavigateToStrings]]></Obj>
<Details ><![CDATA[]]></Details>
<Time><![CDATA[2/4/2016 - 15:44:26]]></Time>
<TimeTick>1454618666</TimeTick>
<NodeArgs eType="User" icon="7" nRep="65" status="Passed" >
<Disp><![CDATA[NavigateToStrings]]></Disp>
</NodeArgs>
</Step>
<Step rID="T45">
<Obj plainTxt="False" ><![CDATA[Navigation Page]]></Obj>
<Details plainTxt="False" ><![CDATA[Browser]]></Details>
<Time><![CDATA[2/4/2016 - 15:45:26]]></Time>
<TimeTick>1454618726</TimeTick>
<Step rID="T46">
<Obj plainTxt="False" ><![CDATA[Navigation Page]]></Obj>
<Details plainTxt="False" ><![CDATA[Page]]></Details>
<Time><![CDATA[2/4/2016 - 15:45:26]]></Time>
<TimeTick>1454618726</TimeTick>
<Step rID="T47">
<Obj plainTxt="False" ><![CDATA["DWL_Navigate through Service"- Description mismatch]]></Obj>
<Details plainTxt="False" ><![CDATA[The object was not found using the test object description. Check the object's properties.]]></Details>
<Time><![CDATA[2/4/2016 - 15:45:26]]></Time>
<TimeTick>1454618726</TimeTick>
<NodeArgs eType="Replay" icon="10" nRep="362" status="Warning" >
<Disp><![CDATA["DWL_Navigate through Service"- Description mismatch]]></Disp>
</NodeArgs>
</Step>
<Step rID="T48">
<Obj plainTxt="False" ><![CDATA["DWL_Navigate through Service"- Smart Identification]]></Obj>
<Details plainTxt="False" ><![CDATA[<P><span class="text">The smart identification mechanism was invoked.</span></P><P><SPAN class=text>Reason: object not found.</SPAN></P>           <SPAN class=text><b>Original description:</b></SPAN><br>micclass=WebElement<br>innertext=Navigate through Service Request Grid Simple Condition Blocksselect.*<br>html tag=DIV<br><P><FONT face=Verdana size=2><SPAN class=text><B>Smart Identification Alternative Description: </B></SPAN></FONT></P><FONT face=Verdana size=2><u>Base filter properties (64 objects found)&nbsp;</FONT></u><br>
micclass=WebElement<br>html tag=DIV<br><br><FONT face=Verdana size=2><u>Optional filter properties</FONT></u><br>
html id=<SPAN class=passed> (Used</SPAN>, 45 matches)</SPAN><br>class=panel-body ifs-group-body-single<SPAN class=passed> (Used</SPAN>, 1 matches)</SPAN><br>innertext=Navigate through Service Request Grid Simple Condition Blocksselect.*<SPAN class=warning> (Ignored)<FONT color=#000000></FONT></SPAN><br>visible=1<SPAN class=warning> (Ignored)<FONT color=#000000></FONT></SPAN><br>]]></Details>
<Time><![CDATA[2/4/2016 - 15:45:26]]></Time>
<TimeTick>1454618726</TimeTick>
<NodeArgs eType="Replay" icon="11" nRep="363" >
<Disp><![CDATA["DWL_Navigate through Service"- Smart Identification]]></Disp>
</NodeArgs>
</Step>
<Step rID="T49">
<Obj plainTxt="False" ><![CDATA[DWL_Navigate through Service.Exist]]></Obj>
<Details plainTxt="False" ><![CDATA["Object exists"]]></Details>
<Time><![CDATA[2/4/2016 - 15:45:26]]></Time>
<TimeTick>1454618726</TimeTick>
<NodeArgs eType="Replay" icon="10" nRep="364" >
<Disp><![CDATA[DWL_Navigate through Service.Exist]]></Disp>
</NodeArgs>
</Step>
<Step rID="T50">
<Obj plainTxt="False" ><![CDATA[DWL_Navigate through Service.Object]]></Obj>
<Details plainTxt="False" ><![CDATA[]]></Details>
<Time><![CDATA[2/4/2016 - 15:45:26]]></Time>
<TimeTick>1454618726</TimeTick>
<NodeArgs eType="Replay" icon="10" nRep="365" >
<Disp><![CDATA[DWL_Navigate through Service.Object]]></Disp>
</NodeArgs>
</Step>
<Step rID="T51">
<Obj plainTxt="False" ><![CDATA[[ All Questions Combined ].Click]]></Obj>
<Details plainTxt="False" ><![CDATA[]]></Details>
<Time><![CDATA[2/4/2016 - 15:45:28]]></Time>
<TimeTick>1454618728</TimeTick>
<NodeArgs eType="Replay" icon="10" nRep="367" >
<Disp><![CDATA[[ All Questions Combined ].Click]]></Disp>
</NodeArgs>
</Step>
<Step rID="T52">
<Obj plainTxt="False" ><![CDATA[[ Strings ].Click]]></Obj>
<Details plainTxt="False" ><![CDATA[]]></Details>
<Time><![CDATA[2/4/2016 - 15:45:31]]></Time>
<TimeTick>1454618731</TimeTick>
<NodeArgs eType="Replay" icon="10" nRep="369" >
<Disp><![CDATA[[ Strings ].Click]]></Disp>
</NodeArgs>
</Step>
<NodeArgs eType="Context" icon="6" nRep="361" status="Warning" >
<Disp><![CDATA[Navigation Page]]></Disp>
</NodeArgs>
</Step>
<NodeArgs eType="Context" icon="5" nRep="360" status="Warning" >
<Disp><![CDATA[Navigation Page]]></Disp>
</NodeArgs>
</Step>
<Step rID="T53">
<Obj ><![CDATA[NavigateToStrings]]></Obj>
<Details ><![CDATA[]]></Details>
<Time><![CDATA[2/4/2016 - 15:45:31]]></Time>
<TimeTick>1454618731</TimeTick>
<NodeArgs eType="User" icon="7" nRep="370" status="Passed" >
<Disp><![CDATA[NavigateToStrings]]></Disp>
</NodeArgs>
</Step>
<Step rID="T54">
<Obj plainTxt="False" ><![CDATA[Navigation Page]]></Obj>
<Details plainTxt="False" ><![CDATA[Browser]]></Details>
<Time><![CDATA[2/4/2016 - 15:45:35]]></Time>
<TimeTick>1454618735</TimeTick>
<Step rID="T55">
<Obj plainTxt="False" ><![CDATA[Navigation Page]]></Obj>
<Details plainTxt="False" ><![CDATA[Page]]></Details>
<Time><![CDATA[2/4/2016 - 15:45:35]]></Time>
<TimeTick>1454618735</TimeTick>
<Step rID="T56">
<Obj plainTxt="False" ><![CDATA[BTN_Next.Exist]]></Obj>
<Details plainTxt="False" ><![CDATA["Object exists"]]></Details>
<Time><![CDATA[2/4/2016 - 15:45:35]]></Time>
<TimeTick>1454618735</TimeTick>
<NodeArgs eType="Replay" icon="9" nRep="374" >
<Disp><![CDATA[BTN_Next.Exist]]></Disp>
</NodeArgs>
</Step>
<Step rID="T57">
<Obj plainTxt="False" ><![CDATA[BTN_Next.Click]]></Obj>
<Details plainTxt="False" ><![CDATA[]]></Details>
<Time><![CDATA[2/4/2016 - 15:45:35]]></Time>
<TimeTick>1454618735</TimeTick>
<NodeArgs eType="Replay" icon="9" nRep="376" >
<Disp><![CDATA[BTN_Next.Click]]></Disp>
</NodeArgs>
</Step>
<NodeArgs eType="Context" icon="6" nRep="373" >
<Disp><![CDATA[Navigation Page]]></Disp>
</NodeArgs>
</Step>
<NodeArgs eType="Context" icon="5" nRep="372" >
<Disp><![CDATA[Navigation Page]]></Disp>
</NodeArgs>
</Step>
<Step rID="T58">
<Obj ><![CDATA[NavigateToStrings]]></Obj>
<Details ><![CDATA[]]></Details>
<Time><![CDATA[2/4/2016 - 15:45:35]]></Time>
<TimeTick>1454618735</TimeTick>
<NodeArgs eType="User" icon="7" nRep="377" status="Passed" >
<Disp><![CDATA[NavigateToStrings]]></Disp>
</NodeArgs>
</Step>
<Step rID="T59">
<Obj plainTxt="False" ><![CDATA[Strings]]></Obj>
<Details plainTxt="False" ><![CDATA[Browser]]></Details>
<Time><![CDATA[2/4/2016 - 15:45:39]]></Time>
<TimeTick>1454618739</TimeTick>
<Step rID="T60">
<Obj plainTxt="False" ><![CDATA[Strings]]></Obj>
<Details plainTxt="False" ><![CDATA[Page]]></Details>
<Time><![CDATA[2/4/2016 - 15:45:39]]></Time>
<TimeTick>1454618739</TimeTick>
<Step rID="T61">
<Obj plainTxt="False" ><![CDATA[LBL_Strings.Exist]]></Obj>
<Details plainTxt="False" ><![CDATA["Object exists"]]></Details>
<Time><![CDATA[2/4/2016 - 15:45:39]]></Time>
<TimeTick>1454618739</TimeTick>
<NodeArgs eType="Replay" icon="10" nRep="381" >
<Disp><![CDATA[LBL_Strings.Exist]]></Disp>
</NodeArgs>
</Step>
<Step rID="T62">
<Obj plainTxt="False" ><![CDATA[Strings.Sync]]></Obj>
<Details plainTxt="False" ><![CDATA[]]></Details>
<Time><![CDATA[2/4/2016 - 15:45:39]]></Time>
<TimeTick>1454618739</TimeTick>
<NodeArgs eType="Replay" icon="6" nRep="383" >
<Disp><![CDATA[Strings.Sync]]></Disp>
</NodeArgs>
</Step>
<Step rID="T63">
<Obj plainTxt="False" ><![CDATA[LBL_Strings.Exist]]></Obj>
<Details plainTxt="False" ><![CDATA["Object exists"]]></Details>
<Time><![CDATA[2/4/2016 - 15:45:48]]></Time>
<TimeTick>1454618748</TimeTick>
<NodeArgs eType="Replay" icon="10" nRep="385" >
<Disp><![CDATA[LBL_Strings.Exist]]></Disp>
</NodeArgs>
</Step>
<NodeArgs eType="Context" icon="6" nRep="380" >
<Disp><![CDATA[Strings]]></Disp>
</NodeArgs>
</Step>
<NodeArgs eType="Context" icon="5" nRep="379" >
<Disp><![CDATA[Strings]]></Disp>
</NodeArgs>
</Step>
<Step rID="T64">
<Obj ><![CDATA[NavigateToStrings]]></Obj>
<Details ><![CDATA[]]></Details>
<Time><![CDATA[2/4/2016 - 15:45:48]]></Time>
<TimeTick>1454618748</TimeTick>
<NodeArgs eType="User" icon="7" nRep="386" status="Passed" >
<Disp><![CDATA[NavigateToStrings]]></Disp>
</NodeArgs>
</Step>
<Step rID="T65">
<Obj plainTxt="False" ><![CDATA[Run Error]]></Obj>
<Details plainTxt="False" ><![CDATA[The &quot;TWL_OneColStringRO&quot; WebElement object was not found in the Object Repository.<BR>Check the Object Repository to confirm that the object exists or to find the correct name for the object.<BR>Function file: C:\Impact\Trunk_IFS_QuestionTypes\Libraries\AUTLibraries\AUTLibrary.vbs<BR>Line (1111): &quot;	Browser(&quot;Strings&quot;).Page(&quot;Strings&quot;).WebElement(&quot;TWL_OneColStringRO&quot;).VerifyFieldIsReadOnly&quot;.]]></Details>
<Time><![CDATA[2/4/2016 - 15:45:52]]></Time>
<TimeTick>1454618752</TimeTick>
<NodeArgs eType="Replay" icon="12" nRep="387" status="Failed" Source="C:\Impact\Trunk_IFS_QuestionTypes\Libraries\AUTLibraries\AUTLibrary.vbs" SourceLine="1110" >
<Disp><![CDATA[Run Error]]></Disp>
</NodeArgs>
</Step>
<Step rID="T66">
<Obj plainTxt="False" ><![CDATA[Run Error]]></Obj>
<Details plainTxt="False" ><![CDATA[The &quot;TWL_TwoColumnReadOnlyString&quot; WebElement object was not found in the Object Repository.<BR>Check the Object Repository to confirm that the object exists or to find the correct name for the object.<BR>Function file: C:\Impact\Trunk_IFS_QuestionTypes\Libraries\AUTLibraries\AUTLibrary.vbs<BR>Line (1112): &quot;	Browser(&quot;Strings&quot;).Page(&quot;Strings&quot;).WebElement(&quot;TWL_TwoColumnReadOnlyString&quot;).VerifyFieldIsReadOnly&quot;.]]></Details>
<Time><![CDATA[2/4/2016 - 15:45:52]]></Time>
<TimeTick>1454618752</TimeTick>
<NodeArgs eType="Replay" icon="12" nRep="388" status="Failed" Source="C:\Impact\Trunk_IFS_QuestionTypes\Libraries\AUTLibraries\AUTLibrary.vbs" SourceLine="1111" >
<Disp><![CDATA[Run Error]]></Disp>
</NodeArgs>
</Step>
<Step rID="T67">
<Obj plainTxt="False" ><![CDATA[[ WebButton ].Click]]></Obj>
<Details plainTxt="False" ><![CDATA[]]></Details>
<Time><![CDATA[2/4/2016 - 15:45:56]]></Time>
<TimeTick>1454618756</TimeTick>
<NodeArgs eType="Replay" icon="9" nRep="390" >
<Disp><![CDATA[[ WebButton ].Click]]></Disp>
</NodeArgs>
</Step>
<Step rID="T68">
<Obj plainTxt="False" ><![CDATA[[ Logout ].Click]]></Obj>
<Details plainTxt="False" ><![CDATA[]]></Details>
<Time><![CDATA[2/4/2016 - 15:45:56]]></Time>
<TimeTick>1454618756</TimeTick>
<NodeArgs eType="Replay" icon="10" nRep="392" >
<Disp><![CDATA[[ Logout ].Click]]></Disp>
</NodeArgs>
</Step>
<Step rID="T69">
<Obj ><![CDATA[Logout]]></Obj>
<Details ><![CDATA[]]></Details>
<Time><![CDATA[2/4/2016 - 15:45:56]]></Time>
<TimeTick>1454618756</TimeTick>
<NodeArgs eType="User" icon="7" nRep="393" status="Passed" >
<Disp><![CDATA[Logout]]></Disp>
</NodeArgs>
</Step>
<Step rID="T70">
<Obj plainTxt="False" ><![CDATA[Run Error]]></Obj>
<Details plainTxt="False" ><![CDATA[Object required: 'Wscript'<BR>Function file: C:\Impact\Trunk_IFS_QuestionTypes\Libraries\GeneralLibraries\CommonLibrary.vbs<BR>Line (657): &quot;	Set objNetwork = Wscript.CreateObject(&quot;Wscript.Network&quot;)&quot;.]]></Details>
<Time><![CDATA[2/4/2016 - 15:47:54]]></Time>
<TimeTick>1454618874</TimeTick>
<NodeArgs eType="Replay" icon="12" nRep="394" status="Failed" Source="C:\Impact\Trunk_IFS_QuestionTypes\Libraries\GeneralLibraries\CommonLibrary.vbs" SourceLine="656" >
<Disp><![CDATA[Run Error]]></Disp>
</NodeArgs>
</Step>
<Step rID="T71">
<Obj plainTxt="False" ><![CDATA[Run Error]]></Obj>
<Details plainTxt="False" ><![CDATA[Object required: 'objNetwork'<BR>Function file: C:\Impact\Trunk_IFS_QuestionTypes\Libraries\GeneralLibraries\CommonLibrary.vbs<BR>Line (658): &quot;	currUser = objNetwork.UserName&quot;.]]></Details>
<Time><![CDATA[2/4/2016 - 15:47:54]]></Time>
<TimeTick>1454618874</TimeTick>
<NodeArgs eType="Replay" icon="12" nRep="395" status="Failed" Source="C:\Impact\Trunk_IFS_QuestionTypes\Libraries\GeneralLibraries\CommonLibrary.vbs" SourceLine="657" >
<Disp><![CDATA[Run Error]]></Disp>
</NodeArgs>
</Step>
<Summary sTime="2/4/2016 - 15:42:55" eTime="2/4/2016 - 15:47:55" passed="13" failed="4" warnings="1" ></Summary>
<NodeArgs eType="StartAction" icon="3" nRep="6" status="Failed" >
<Disp><![CDATA[Action1 Summary]]></Disp>
</NodeArgs>
</Action>
<Summary sTime="2/4/2016 - 15:42:53" eTime="2/4/2016 - 15:47:55" passed="13" failed="4" warnings="1" ></Summary>
<NodeArgs eType="StartTest" icon="1" nRep="3" status="Failed" >